{
  "schema_version": "1.0",
  "total_cases": 40,
  "confidence_level": 0.95,
  "step": {
    "correct": 40,
    "total": 40,
    "accuracy": 1.0,
    "interval": [
      0.9123783988027133,
      1.0
    ]
  },
  "top3_step": {
    "correct": 40,
    "total": 40,
    "accuracy": 1.0,
    "interval": [
      0.9123783988027133,
      1.0
    ]
  },
  "agent": {
    "correct": 40,
    "total": 40,
    "accuracy": 1.0,
    "interval": [
      0.9123783988027133,
      1.0
    ]
  },
  "category": {
    "correct": 40,
    "total": 40,
    "accuracy": 1.0,
    "interval": [
      0.9123783988027133,
      1.0
    ]
  },
  "mean_confidence": 0.795359,
  "calibration_gap": -0.204641,
  "outcomes": [
    {
      "case_id": "empty-retrieval-1",
      "expected_span": "empty-retrieval-1-s03",
      "predicted_span_id": "empty-retrieval-1-s03",
      "predicted_span_name": "kb_search",
      "predicted_agent": "billing",
      "predicted_category": "empty_retrieval",
      "confidence": 0.9,
      "step_correct": true,
      "top3_correct": true,
      "agent_correct": true,
      "category_correct": true
    },
    {
      "case_id": "empty-retrieval-2",
      "expected_span": "empty-retrieval-2-s06",
      "predicted_span_id": "empty-retrieval-2-s06",
      "predicted_span_name": "kb_search",
      "predicted_agent": "refunds",
      "predicted_category": "empty_retrieval",
      "confidence": 0.636923,
      "step_correct": true,
      "top3_correct": true,
      "agent_correct": true,
      "category_correct": true
    },
    {
      "case_id": "empty-retrieval-3",
      "expected_span": "empty-retrieval-3-s03",
      "predicted_span_id": "empty-retrieval-3-s03",
      "predicted_span_name": "kb_search",
      "predicted_agent": "account",
      "predicted_category": "empty_retrieval",
      "confidence": 0.9,
      "step_correct": true,
      "top3_correct": true,
      "agent_correct": true,
      "category_correct": true
    },
    {
      "case_id": "empty-retrieval-4",
      "expected_span": "empty-retrieval-4-s06",
      "predicted_span_id": "empty-retrieval-4-s06",
      "predicted_span_name": "kb_search",
      "predicted_agent": "orders",
      "predicted_category": "empty_retrieval",
      "confidence": 0.636923,
      "step_correct": true,
      "top3_correct": true,
      "agent_correct": true,
      "category_correct": true
    },
    {
      "case_id": "handoff-loop-1",
      "expected_span": "handoff-loop-1-s01",
      "predicted_span_id": "handoff-loop-1-s01",
      "predicted_span_name": "handoff to billing",
      "predicted_agent": "router",
      "predicted_category": "handoff_loop",
      "confidence": 0.85,
      "step_correct": true,
      "top3_correct": true,
      "agent_correct": true,
      "category_correct": true
    },
    {
      "case_id": "handoff-loop-2",
      "expected_span": "handoff-loop-2-s01",
      "predicted_span_id": "handoff-loop-2-s01",
      "predicted_span_name": "handoff to refunds",
      "predicted_agent": "triage",
      "predicted_category": "handoff_loop",
      "confidence": 0.85,
      "step_correct": true,
      "top3_correct": true,
      "agent_correct": true,
      "category_correct": true
    },
    {
      "case_id": "handoff-loop-3",
      "expected_span": "handoff-loop-3-s01",
      "predicted_span_id": "handoff-loop-3-s01",
      "predicted_span_name": "handoff to account",
      "predicted_agent": "dispatcher",
      "predicted_category": "handoff_loop",
      "confidence": 0.85,
      "step_correct": true,
      "top3_correct": true,
      "agent_correct": true,
      "category_correct": true
    },
    {
      "case_id": "handoff-loop-4",
      "expected_span": "handoff-loop-4-s01",
      "predicted_span_id": "handoff-loop-4-s01",
      "predicted_span_name": "handoff to orders",
      "predicted_agent": "supervisor",
      "predicted_category": "handoff_loop",
      "confidence": 0.85,
      "step_correct": true,
      "top3_correct": true,
      "agent_correct": true,
      "category_correct": true
    },
    {
      "case_id": "injected-latency-1",
      "expected_span": "injected-latency-1-s03",
      "predicted_span_id": "injected-latency-1-s03",
      "predicted_span_name": "kb_search",
      "predicted_agent": "billing",
      "predicted_category": "injected_fault",
      "confidence": 0.750408,
      "step_correct": true,
      "top3_correct": true,
      "agent_correct": true,
      "category_correct": true
    },
    {
      "case_id": "injected-latency-2",
      "expected_span": "injected-latency-2-s03",
      "predicted_span_id": "injected-latency-2-s03",
      "predicted_span_name": "kb_search",
      "predicted_agent": "refunds",
      "predicted_category": "injected_fault",
      "confidence": 0.750408,
      "step_correct": true,
      "top3_correct": true,
      "agent_correct": true,
      "category_correct": true
    },
    {
      "case_id": "injected-latency-3",
      "expected_span": "injected-latency-3-s03",
      "predicted_span_id": "injected-latency-3-s03",
      "predicted_span_name": "kb_search",
      "predicted_agent": "account",
      "predicted_category": "injected_fault",
      "confidence": 0.750408,
      "step_correct": true,
      "top3_correct": true,
      "agent_correct": true,
      "category_correct": true
    },
    {
      "case_id": "injected-latency-4",
      "expected_span": "injected-latency-4-s03",
      "predicted_span_id": "injected-latency-4-s03",
      "predicted_span_name": "kb_search",
      "predicted_agent": "orders",
      "predicted_category": "injected_fault",
      "confidence": 0.750408,
      "step_correct": true,
      "top3_correct": true,
      "agent_correct": true,
      "category_correct": true
    },
    {
      "case_id": "injected-tool-error-1",
      "expected_span": "injected-tool-error-1-s02",
      "predicted_span_id": "injected-tool-error-1-s02",
      "predicted_span_name": "update_order",
      "predicted_agent": "billing",
      "predicted_category": "injected_fault",
      "confidence": 1.0,
      "step_correct": true,
      "top3_correct": true,
      "agent_correct": true,
      "category_correct": true
    },
    {
      "case_id": "injected-tool-error-2",
      "expected_span": "injected-tool-error-2-s05",
      "predicted_span_id": "injected-tool-error-2-s05",
      "predicted_span_name": "update_order",
      "predicted_agent": "refunds",
      "predicted_category": "injected_fault",
      "confidence": 0.817632,
      "step_correct": true,
      "top3_correct": true,
      "agent_correct": true,
      "category_correct": true
    },
    {
      "case_id": "injected-tool-error-3",
      "expected_span": "injected-tool-error-3-s02",
      "predicted_span_id": "injected-tool-error-3-s02",
      "predicted_span_name": "update_order",
      "predicted_agent": "account",
      "predicted_category": "injected_fault",
      "confidence": 1.0,
      "step_correct": true,
      "top3_correct": true,
      "agent_correct": true,
      "category_correct": true
    },
    {
      "case_id": "injected-tool-error-4",
      "expected_span": "injected-tool-error-4-s05",
      "predicted_span_id": "injected-tool-error-4-s05",
      "predicted_span_name": "update_order",
      "predicted_agent": "orders",
      "predicted_category": "injected_fault",
      "confidence": 0.817632,
      "step_correct": true,
      "top3_correct": true,
      "agent_correct": true,
      "category_correct": true
    },
    {
      "case_id": "nested-tool-failure-1",
      "expected_span": "nested-tool-failure-1-s03",
      "predicted_span_id": "nested-tool-failure-1-s03",
      "predicted_span_name": "issue_refund",
      "predicted_agent": "billing",
      "predicted_category": "tool_error",
      "confidence": 0.95,
      "step_correct": true,
      "top3_correct": true,
      "agent_correct": true,
      "category_correct": true
    },
    {
      "case_id": "nested-tool-failure-2",
      "expected_span": "nested-tool-failure-2-s04",
      "predicted_span_id": "nested-tool-failure-2-s04",
      "predicted_span_name": "issue_refund",
      "predicted_agent": "refunds",
      "predicted_category": "tool_error",
      "confidence": 0.95,
      "step_correct": true,
      "top3_correct": true,
      "agent_correct": true,
      "category_correct": true
    },
    {
      "case_id": "nested-tool-failure-3",
      "expected_span": "nested-tool-failure-3-s03",
      "predicted_span_id": "nested-tool-failure-3-s03",
      "predicted_span_name": "issue_refund",
      "predicted_agent": "account",
      "predicted_category": "tool_error",
      "confidence": 0.95,
      "step_correct": true,
      "top3_correct": true,
      "agent_correct": true,
      "category_correct": true
    },
    {
      "case_id": "nested-tool-failure-4",
      "expected_span": "nested-tool-failure-4-s04",
      "predicted_span_id": "nested-tool-failure-4-s04",
      "predicted_span_name": "issue_refund",
      "predicted_agent": "orders",
      "predicted_category": "tool_error",
      "confidence": 0.95,
      "step_correct": true,
      "top3_correct": true,
      "agent_correct": true,
      "category_correct": true
    },
    {
      "case_id": "planner-model-error-1",
      "expected_span": "planner-model-error-1-s02",
      "predicted_span_id": "planner-model-error-1-s02",
      "predicted_span_name": "plan",
      "predicted_agent": "billing",
      "predicted_category": "model_error",
      "confidence": 0.662121,
      "step_correct": true,
      "top3_correct": true,
      "agent_correct": true,
      "category_correct": true
    },
    {
      "case_id": "planner-model-error-2",
      "expected_span": "planner-model-error-2-s05",
      "predicted_span_id": "planner-model-error-2-s05",
      "predicted_span_name": "plan",
      "predicted_agent": "refunds",
      "predicted_category": "model_error",
      "confidence": 0.560257,
      "step_correct": true,
      "top3_correct": true,
      "agent_correct": true,